Question_Log_URL,Full_Answer_Text,Date
https://www.quora.com/Which-is-the-best-course-for-learning-algorithms-and-data-structure-on-Coursera-edX-or-Udemy/log,"In the age of the internet, a wealth of online resources is available to delve into and grasp the concepts of data structures and algorithms. However, this approach is often deemed ineffective due to its exhaustive and time-consuming nature. Learning data structures and algorithms is primarily geared towards excelling in interviews, with limited application in day-to-day work within a company. Therefore, investing excessive time and energy in learning these concepts can be considered inefficient and a misuse of resources.
Coursera: Coursera, a prominent free learning platform, offers a variety of technical courses from esteemed universities. These courses provide the convenience of pre-recorded video lectures for flexible learning. One notable course is the UC San Diego Algorithm course, which emphasizes practical programming with a focus on algorithms. It covers essential data structures like arrays, linked lists, stacks, and queues, progressing into dynamic arrays, amortized analysis, priority queues, disjoint sets, hash tables, and binary search trees. Additionally, the Stanford course on Coursera stands out, placing significant emphasis on mathematical proofs, ensuring a profound understanding of algorithm efficiency and equipping learners with essential mathematical tools for evaluating future algorithms.
Udemy: Udemy offers various Data Structures and Algorithms (DSA) courses, catering to learners with different levels of expertise. The ""Mastering Data Structures & Algorithms using C and C++"" course is renowned for its comprehensiveness and immersion in the realm of data structures and algorithms using C and C++. Instructor Abdul Bari takes a deep dive into each topic, employing a Whiteboard to methodically write and explain every line of code. The course is designed to be easily grasped by learners, providing a thorough understanding of DSA principles.
edX: EdX provides various courses related to Data Structures and Algorithms (DSA). The ""Algorithmic Design and Techniques"" course from the University of Pennsylvania is self-paced and focuses on fundamental algorithmic design paradigms and techniques. It aims to enhance students' algorithmic thinking and problem-solving skills.
While Coursera, Udemy, and edX are valuable learning platforms, they may lack certain features in aspects such as job opportunities, live classes, real-time feedback, and placement features in their Data Structures and Algorithms courses. In contrast, Tutort Academy's DSA course is a more comprehensive option, offering a robust set of features that extend beyond traditional online learning experiences.
Highlighted features of this academy:
1. Live Classes with 1:1 doubt clearing session:
Conducts live classes, providing an interactive and engaging learning experience, allowing students to actively participate, ask questions in real-time, and collaborate with instructors and peers.
2. Experienced Instructors:
Boasts a team of over 200 experienced instructors who bring expertise from top-tier companies, ensuring high-quality and industry-relevant instruction.
3. 1000+ Placement Record:
Demonstrates a proven track record of placing over 1000 students in top-tier companies, including Google, Microsoft, Samsung, Adobe, Walmart, and many more. Focuses on career transitions, offering guaranteed job calls and partnerships with numerous top-tier companies, providing ample opportunities for students.
4. Ideal for Service to Product-Based Transition:
Tailored to cater to working professionals aiming to transition from service-based to product-based companies, providing relevant skills for career advancement.
5. Best for Working Professionals:
Recognizes the needs of working professionals and offers a curriculum designed to accommodate their schedules, ensuring practical and applicable learning.
6. 2-Year Flexible Pass:
Unique offering that provides a 2-year flexible pass, allowing students the flexibility to attend multiple batches without incurring additional costs.
7. 2-Step Counseling Process:
Features a 2-step counseling process that enables students to directly connect with mentors, fostering a personalized and supportive learning environment.
In conclusion, while online platforms like Coursera, Udemy, and edX offer valuable resources for learning data structures and algorithms, Tutort Academy stands out with its comprehensive features, including live classes, experienced instructors, a stellar placement record, and specialized offerings for working professionals, making it a top choice for a holistic and practical learning experience in DSA.","January 31, 2024 at 2:10:14 AM"
https://www.quora.com/Which-is-the-best-course-for-learning-algorithms-and-data-structure-on-Coursera-edX-or-Udemy/log,"Coursera, edX, and Udemy are reputable online learning platforms that offer a variety of courses to learn algorithms and data structures. The best course for you depends on your learning style, preferences, and the depth of knowledge you seek. While these platforms provide decent options, there's also an emerging platform called Expertifie that stands out for its unique features.
Coursera, edX, and Udemy:
1.Coursera:
Coursera hosts courses from top universities and institutions globally, making it an excellent choice for those seeking a more structured and academic approach. The ""Algorithms Specialization"" by Stanford University is highly recommended, covering fundamental algorithms and offering hands-on assignments. Coursera's certification upon course completion can be a valuable credential.
2. edX:
Similar to Coursera, edX partners with universities to deliver high-quality courses. The ""Algorithmic Design and Techniques"" course from the University of Pennsylvania is a notable example, balancing theoretical knowledge with practical coding applications. edX also provides verified certificates, enhancing the credibility of your achievements.
3. Udemy:
Udemy stands out for its vast array of courses created by individual instructors, offering diverse teaching styles. ""Master the Coding Interview: Data Structures + Algorithms"" is a well-received course on Udemy, emphasizing practical problem-solving skills. Udemy courses are often more affordable, and the lifetime access feature allows for flexibility in learning.
Expertifie:In addition to the established platforms, Expertifie is an emerging player that deserves attention for its distinctive features:
Expertifie:
Expertifie sets itself apart by focusing specifically on algorithmic problem-solving and interview preparation. The platform provides a curated set of coding challenges, frequently updated to align with industry standards. The challenges cover various difficulty levels, ensuring learners can progressively enhance their coding proficiency.
One of the standout features of Expertifie is its mentorship program, connecting learners with experienced professionals from top tech companies. This mentorship provides personalized guidance, career advice, and insights into the industry, enriching the learning experience with real-world perspectives.
Expertifie's emphasis on practical coding skills is complemented by mock interviews that simulate real-world scenarios. This allows learners to practice problem-solving and coding skills under timed conditions, preparing them thoroughly for the intensity of technical interviews.
The platform also provides in-depth tutorials, video lectures, and articles covering various data structures and algorithms. Expertifie's holistic approach ensures that learners not only grasp theoretical concepts but also become proficient in expressing their solutions in code, a crucial skill for success in technical interviews.
Ultimately, the best platform and course for learning algorithms and data structures depend on your preferences and learning objectives. Coursera, edX, and Udemy offer a range of options to cater to different needs, while Expertifie stands out for its specialized focus on practical coding skills and mentorship, making it a compelling choice for those preparing for technical interviews and aiming for excellence in algorithmic problem-solving.","January 9, 2024 at 9:44:34 PM"
https://www.quora.com/Which-is-the-best-course-for-learning-algorithms-and-data-structure-on-Coursera-edX-or-Udemy/log,"When it comes to learning Algorithms and Data Structures (DSA), platforms like Coursera, edX, and Udemy offer a plethora of courses. Each platform has its unique strengths, but one notable standout platform is Expertifie, which provides an exceptional course designed to master DSA and specifically caters to preparing candidates for MAANG interviews.
Coursera: Coursera is renowned for collaborating with top universities and organizations, offering a variety of DSA courses. The ""Algorithms Specialization"" by Stanford University is particularly notable. This specialization, taught by Tim Roughgarden, covers fundamental algorithms, graph algorithms, and dynamic programming. Coursera's interactive assignments and peer-graded assessments provide a structured learning experience. However, the practical application of the learned concepts might be limited compared to other platforms.
edX: edX, in partnership with institutions like MIT and Harvard, provides rigorous DSA courses. The ""Algorithm and Data Structures MicroMasters Program"" by the University of California, San Diego, stands out. Covering algorithmic design paradigms and advanced data structures, this program is suitable for learners seeking a deep understanding of DSA. edX's courses often have a theoretical focus, providing a strong academic foundation in algorithms.
Udemy: Udemy is known for its vast library of courses, and DSA is no exception. ""Master the Coding Interview: Data Structures + Algorithms"" by Andrei Neagoie is one such comprehensive course. It covers not only the theory but also emphasizes practical implementation through coding exercises. Udemy's advantage lies in its affordability and lifetime access to courses, making it suitable for self-paced learners on a budget.
Expertifie's Data Structures and Algorithms Course: Expertifie's Data Structures and Algorithms course is a standout choice for those aiming to master DSA. The curriculum covers a broad spectrum, including foundational data structures (arrays, linked lists, trees) and advanced algorithms (sorting, searching, dynamic programming). The content is delivered through video lectures, interactive coding exercises, and real-world projects, ensuring a well-rounded learning experience.
Course Features:
Suitability: Expertifie's DSA course is suitable for a wide range of learners, from beginners to experienced developers looking to deepen their understanding. The structured curriculum and practical orientation make it accessible for those starting their DSA journey, while the advanced topics cater to those seeking a more in-depth exploration of algorithms and data structures.
Advantages:
Mock Interviews: One unique feature of Expertifie's DSA course is the inclusion of mock interviews, specifically tailored for candidates looking to crack MAANG interviews. These mock interviews simulate real-world interview scenarios, preparing learners for technical assessments and coding challenges commonly encountered in major tech company interviews. This hands-on practice is invaluable for boosting confidence and performance in high-stakes interviews.
In conclusion, while Coursera, edX, and Udemy offer commendable DSA courses, Expertifie's Data Structures and Algorithms course stands out for its practical approach, real-world projects, and unique focus on preparing candidates for MAANG interviews. It provides a holistic learning experience, making it an excellent choice for anyone aspiring to master algorithms and data structures in a practical and industry-oriented manner.","January 5, 2024 at 10:56:24 PM"
https://www.quora.com/Which-is-the-best-course-for-learning-algorithms-and-data-structure-on-Coursera-edX-or-Udemy/log,"Coursera, edX, and Udemy are reputable platforms which are good to consider for algorithms and data structures, but I would urge you to check out Expertifie. Expertifie is a standout choice that surpasses them in terms of hands-on learning, interview preparation, and comprehensive curriculum – Expertifie's Data Structures and Algorithms course. While these platforms are excellent and have their merits, Expertifie's course offers a unique and enriching learning experience that sets it apart from the rest.
Coursera, edX, and Udemy: Coursera, edX, and Udemy are widely recognized for hosting a diverse range of courses, including those on algorithms and data structures. These platforms often collaborate with top universities and industry experts to deliver high-quality content. Coursera's ""Algorithms Specialization"" by Stanford University and edX's ""Introduction to Computer Science and Programming Using Python (MITx)"" are notable courses. Udemy, on the other hand, offers courses like ""Master the Coding Interview: Data Structures + Algorithms"" by Andrei Neagoie. These platforms provide flexibility, allowing learners to study at their own pace, but the efficacy of the courses may vary.
Why Expertifie's Data Structures and Algorithms Course Stands Out:
Other Interactive Offerings by Expertifie -
In conclusion, while Coursera, edX, and Udemy offer commendable courses on algorithms and data structures, Expertifie's Data Structures and Algorithms course stands out for its practical emphasis, interview preparation focus, comprehensive curriculum, industry relevance, personalized learning experience, experienced instructors, and community support. I highly recommend checking out Expertifie's course as it provides a unique and enriching learning experience that goes beyond traditional theoretical approaches, preparing learners for success in both interviews and real-world applications.","January 5, 2024 at 9:35:17 PM"
https://www.quora.com/Which-is-the-best-course-for-learning-algorithms-and-data-structure-on-Coursera-edX-or-Udemy/log,"The ""best"" course for learning algorithms and data structures can vary depending on your learning style, prior knowledge, and preferences. Here are some highly regarded courses on Coursera, edX, and Udemy:
Coursera:
edX:
Udemy:
Considerations:
Ultimately, the ""best"" course depends on your individual preferences and goals. It might be beneficial to start with a course that aligns with your current skill level and gradually progress to more advanced topics.
If you're a working professional seeking to enhance your knowledge and skills in algorithms and data structures, I highly suggest considering Tutort Academy. It's a distinctive and innovative online learning platform designed with working individuals in mind. This platform acknowledges the challenges faced by those balancing personal and professional lives and aims to provide a tailored solution through its comprehensive program.
One standout aspect is its live and interactive classes, which create an engaging learning environment where students can actively participate and receive clarification on doubts. In contrast to traditional online platforms, They maintain small class sizes to ensure personalized attention and ample opportunities for seeking clarity on concepts. The mentors at Tutort Academy possess extensive experience working in top multinational companies like Google, Microsoft, and Amazon. This real-world expertise ensures students receive high-quality training and benefit from the guidance of experienced professionals.
They go above and beyond to offer personalized support to their students. The academy provides personalized doubt-clearing sessions, allowing students to address specific questions or concerns. This individualized attention ensures students receive the necessary support to excel in their learning journey.
What sets them apart is the ""Profile Review by Experts"" feature. After shortlisting a student's profile, experts personally review it and engage in discussions with the students. This approach offers students the chance to clarify doubts, understand the course roadmap, explore its importance, and gain insights into career prospects. This personalized counseling enhances the learning experience and aids students in making informed decisions.
Dedicated placement assistance is also a notable feature. They have partnerships with top multinational companies, guaranteeing interview calls for all students. With a successful track record of placing over 1000 students, their experts assist in creating professional LinkedIn profiles, building impressive resumes, and participating in mock interviews conducted by industry professionals. These initiatives boost students' confidence and prepare them for real-world job interviews.
Flexibility is another advantage. Upon enrollment, students gain a two-year membership with access to multiple batches and mentors. This flexibility allows professionals to attend classes as per their schedule, without disrupting their current commitments.
Furthermore, they offer lifetime access to recorded lectures and course content, allowing students to revisit materials even after completing the course. This convenience offers flexibility in their learning journey, allowing them to study at their own pace and from any location.
In addition to Tutort Academy, you might also explore Udacity courses for improving your coding skills. It offers a variety of resources, such as practice problems, coding contests, discussion forums, editorials, tutorials, and certification exams to validate your programming skills.
In conclusion, if placement is a priority, Tutort Academy courses provide a comprehensive array of features to support your job-seeking efforts","January 5, 2024 at 12:23:12 PM"
https://www.quora.com/Is-it-worth-paying-for-Andrew-Ngs-machine-learning-course-on-Coursera/log,"💡 Is It Worth Paying for Andrew Ng’s Machine Learning Course on Coursera?
You’ve probably seen it recommended everywhere.
It’s legendary. It’s popular. But is it worth the money?
Let’s break it down — no fluff, just facts.
🎓 What You Get in the Course (Paid or Free)
Andrew Ng’s ML course is a foundational course that teaches:
Whether you pay or audit, you get access to:
💰 So, What’s the Difference When You Pay?
Paying (usually ₹3,200–₹4,000 or ~$49/month) gives you:
📝 If you're aiming for career switches, job applications, or LinkedIn visibility — the certificate can add value.
✅ When It’s Worth Paying
❌ When You Can Skip Paying
Reminder: You can always audit the course for free and still get full access to the learning materials.
🎯 Want a More Practical, Project-Based Option After This?
Once you've done Andrew Ng’s course (free or paid), check out Tutort Academy — a hands-on, beginner-focused AI program built for real-world skills.
🧠 Final Verdict
The content is absolutely worth it — whether you pay or not.
If the certificate adds strategic value for your resume or keeps you committed to finishing — then yes, it’s worth paying for.
If not, audit it for free, and invest that money into your next step (like project-based learning, tools, or mentoring).
Still confused about what’s best for your goals? Drop your background or plan — I’ll help you decide. 👇","April 15, 2025 at 3:20:28 AM"
https://www.quora.com/Is-it-worth-paying-for-Andrew-Ngs-machine-learning-course-on-Coursera/log,"Andrew Ng’s Machine Learning course on Coursera is one of the most popular online programs for beginners and intermediate learners in AI. But with both free and paid options available, many wonder: Is it worth paying for the certificate?
In this detailed analysis, we’ll break down:
Course content & structure
Free vs. Paid benefits
Career value of the certificate
Alternatives (free & paid)
Final verdict: Who should pay?
1. Course Overview – What Does Andrew Ng’s ML Course Cover?
Andrew Ng, a Stanford professor and co-founder of Coursera, designed this course as a foundational introduction to machine learning.
Key Topics Covered:
Supervised Learning (Linear Regression, Logistic Regression, SVMs)
Unsupervised Learning (Clustering, PCA)
Neural Networks & Deep Learning Basics
Bias-Variance Tradeoff & Model Evaluation
Practical Advice for ML Projects
Teaching Style:
Clear explanations – Math is simplified for beginners
Octave/Matlab assignments – Helps solidify concepts (though some find this outdated)
Real-world case studies – e.g., spam detection, image recognition
Strengths:
Excellent for beginners – No heavy math prerequisites
Well-structured – Step-by-step progression
Andrew Ng’s reputation – One of the best AI educators
Weaknesses:
Uses Octave (not Python) – Less industry-relevant today
No deep learning focus – Only basic neural networks covered
2. Free vs. Paid Version – What’s the Difference?
The course is free to audit, meaning you can access all lectures and quizzes without paying. However, the paid version ($49–$79/month) unlocks:
Paid Benefits:
Verified Certificate – Shareable on LinkedIn/resume
Graded Assignments – Required for certificate
Full Course Access – Even if Coursera changes policies
Financial Aid Available – Can apply for a fee waiver
Is the Certificate Worth It?
Yes, if:
You need proof of learning for jobs/resume
Your employer/university values Coursera certs
You want motivation to complete the course
No, if:
You’re learning just for knowledge
You already have strong ML projects/experience
3. Career Value – Does This Course Help in Jobs?
Will Employers Recognize It?
For Beginners: The certificate adds credibility, especially if you lack formal education in ML
For Experienced Professionals: Projects matter more than certificates
Where It Helps:
Resume Filtering – Some recruiters recognize Andrew Ng’s course
Interview Prep – Covers fundamental ML concepts asked in entry-level roles
Transitioning into Data Science – Good first step before advanced courses
Limitations:
Not a Job Guarantee – You’ll need additional projects & Python skills
No Hands-on Python Coding – Most jobs require Python (NumPy, Scikit-learn)
4. Free Alternatives vs. Paid Coursera Course
Free Alternatives:
Google’s Machine Learning Crash Course (Free, Python-based)
Fast.ai (Practical Deep Learning)
MIT OpenCourseWare – Intro to ML (More theoretical)
Paid Alternatives:
Udacity’s Machine Learning Nanodegree (~$399/month, more hands-on)
DeepLearning.AI’s TensorFlow Specialization (Andrew Ng’s newer course)
Why Choose Andrew Ng’s Course Over Others?
Strong theoretical foundation – Better for academic understanding
Reputable instructor – Andrew Ng is an AI legend
Beginner-friendly – Gentle learning curve
5. Final Verdict – Should You Pay for the Certificate?
Worth It For:
Beginners – If you need structured learning & a certificate
Career Switchers – Adds credibility to your resume
Students – Useful for supplementing academic studies
Not Worth It For:
Self-learners with discipline – Free audit is enough
Experienced coders – You might need more advanced material
Best Approach:
Audit the course for free – See if you like the teaching style
If useful, pay later – Coursera allows upgrading anytime
Supplement with Python projects – Use Kaggle or personal datasets
Conclusion: Yes, But With a Strategy
Andrew Ng’s Machine Learning course is still valuable, especially for beginners. The paid certificate can be worth it if you need formal proof of learning, but the free version is sufficient for knowledge.
For maximum career impact, combine it with:
Python-based ML projects (Kaggle, GitHub)
More advanced courses (DeepLearning.AI, Fast.ai)
Networking & internships
Final Rating: 4/5 – Great for fundamentals, but needs supplementation.","April 4, 2025 at 7:01:01 PM"
