Question_Log_URL,Full_Answer_Text,Date
https://www.quora.com/Is-a-Coursera-certificate-useful/log,"It ultimately depends on your career path and the requirements of the job,but they can be highly beneficial depending on your career goals or industry. In some fields, certain certifications are required to meet legal or professional standards (like in healthcare, IT, or project management). In other areas, certifications may be optional but can enhance your resume, skills, and credibility, helping you stand out in a competitive job market.","March 25, 2025 at 3:56:42 PM"
https://www.quora.com/Is-a-Coursera-certificate-useful/log,"Yes, a Coursera certificate can definitely be useful, depending on your goals and how you leverage it. Here are a few reasons why:
1. Credibility and Recognition
Coursera partners with top universities and institutions like Stanford, Yale, and Google, which means the certificates you earn carry weight. Many employers recognize and value the knowledge you gain through Coursera’s courses, especially in fields like IT, data science, business, and technology. Some courses even provide opportunities to earn credentials from the institutions themselves, which can enhance your resume.
2. Skill Development
The certificates aren’t just about a piece of paper—they represent a commitment to learning and gaining practical skills. Whether you’re picking up a new skill or deepening your expertise in a field, Coursera courses are structured to help you build relevant, up-to-date knowledge that’s directly applicable to the workplace.
3. Career Advancement
Many people use Coursera to either switch careers or advance in their current roles. A certificate from a well-known program can help demonstrate your expertise to employers and improve your chances of getting hired or promoted. Courses like the Google IT Support Professional Certificate or the Data Science Specialization by Johns Hopkins University have helped countless learners break into new industries.
4. Flexible Learning
Coursera provides the flexibility to learn at your own pace, which is a huge advantage if you’re balancing work or other commitments. The ability to study from anywhere with internet access means you can advance your education and skills without having to commit to a full-time, in-person program.
5. Verified Certificates for Jobs & Networking
Coursera also offers the option of earning verified certificates, which can be shared on your LinkedIn profile, CV, and job applications. Many companies, including Google, IBM, and Amazon, even partner with Coursera to offer professional certificates, which are recognized in the industry.
6. Increased Earnings Potential
Having a Coursera certificate can give you an edge in the job market and potentially lead to higher-paying opportunities. According to Coursera’s data, learners who complete career-focused programs report a significant salary increase.
In conclusion, while Coursera certificates are not a guarantee of a job, they are a valuable tool in demonstrating your commitment to professional development and acquiring relevant skills in an ever-evolving job market.
If you’re looking to try out any Coursera courses, feel free to check them out here.","February 2, 2025 at 5:06:01 PM"
https://www.quora.com/Is-a-Coursera-certificate-useful/log,"Yes, a Coursera certificate can be quite useful. While it may not hold the same weight as a degree, it demonstrates your commitment to learning and can enhance your resume. Many employers recognize Coursera courses, especially those from reputable universities. Additionally, completing these courses can help you gain practical skills relevant to your field.
If you're looking for more certification options that could complement your learning, consider exploring this resource.","October 25, 2024 at 10:33:45 PM"
https://www.quora.com/Is-a-Coursera-certificate-useful/log,"According to today needs, Directcertify offers a Best Online Certification in market, it provides more than hundreds courses, in one place , with additional practice test, moke test or simulates paper of the real one.
For its user experience and 24/7 support make it diff from other.","October 2, 2024 at 2:00:03 PM"
https://www.quora.com/Is-a-Coursera-certificate-useful/log,"That certificate is nothing but rubbish.
Listen up, because I'm about to give it to you straight. Coursera tutors? They're just full of hot air, no substance. They try to impress you with their skills, but their results don't measure up. And don't even get me started on their ridiculously high prices. But let me introduce you to something genuine, my friend. Turbocourses, Bosscourses, and their crew? They're the real deal. Enroll, become a member, and boom! You'll have access to a wide range of free courses. Trust me, the people on those platforms? They're out there crushing it in life, leaving those Coursera folks in the dust. So, no way am I wasting my time with Coursera. I'm sticking with the winners like Turbocourses, Bosscourses, and all those other top-tier sites. That's how I roll, my friend.","August 3, 2024 at 2:38:56 AM"
https://www.quora.com/Is-a-Coursera-certificate-useful/log,"Yes, Coursera is a global online learning platform that offers access to online courses, while hosting different verified certificates from top institutions in the world. Here is you can apply for financial aids on coursera:","June 20, 2024 at 12:36:17 AM"
https://www.quora.com/Are-online-courses-by-Coursera-worth-it/log,"Career Craft offers job-ready courses at affordable prices, includes live projects to build real experience, and provides placement support to help you land the right role.","April 4, 2025 at 7:47:14 PM"
https://www.quora.com/Are-online-courses-by-Coursera-worth-it/log,"Yes, Coursera offers valuable online courses, especially with certifications from top universities like Harvard, Yale, and Google. Their courses provide:
✅ University-backed content for credibility
✅ Certificates that boost your resume
✅ Flexible, self-paced learning
However, if you're into finance, accounting, or investment banking, WallStreetMojo is a great alternative! It offers practical, job-focused courses in financial modeling, Excel, and investment banking.
🔹 Bonus: They are currently running great offers on their courses, making it a perfect time to enroll! 💰🚀
Are you looking for a specific course? Let me know! 📚✨","March 31, 2025 at 11:40:59 PM"
https://www.quora.com/Are-online-courses-by-Coursera-worth-it/log,"Yes, Coursera courses are generally worth it, depending on your goals and how you use them. Here’s a breakdown of the key benefits and considerations:
Why Coursera Courses Are Worth It:
✔ High-Quality Content: Courses are created by top universities (like Stanford, Harvard, Yale) and industry leaders (Google, IBM, Meta).
✔ Flexible Learning: You can learn at your own pace, making it ideal for working professionals and students.
✔ Certificates & Career Boost: Paid courses offer certificates that can enhance your resume and LinkedIn profile.
✔ Industry-Relevant Skills: Many courses focus on practical skills like data science, AI, business, and programming.
✔ Affordable Compared to Traditional Education: Some courses are free, while paid ones are much cheaper than university tuition.
Things to Consider Before Enrolling:
❌ Certificates May Not Be Recognized Everywhere: While valuable, some employers may prefer traditional degrees.
❌ Self-Discipline Needed: Since it’s self-paced, you must stay motivated to complete the courses.
❌ Some Courses Are Free, But Certificates Cost Money: If you need a certificate, you’ll have to pay or apply for financial aid.
Best for:
Career changers & job seekers
Professionals upgrading skills (tech, business, healthcare, etc.)
Students looking for extra knowledge
If your goal is to learn practical skills, boost your career, or transition into a new field, Coursera is definitely worth it.","March 23, 2025 at 2:02:22 PM"
https://www.quora.com/Are-online-courses-by-Coursera-worth-it/log,"Whether Coursera's online courses are ""worth it"" depends heavily on your individual goals and circumstances. However, we can explore the factors that contribute to their value:What Makes Coursera Potentially Worthwhile:
Reputable Institutions:
Coursera partners with prestigious universities and organizations worldwide. This means you gain access to courses taught by experts in their fields.
Variety of Subjects:
They offer a vast catalog of courses, from computer science and business to arts and humanities. You can find courses that cater to a wide range of interests and career goals.
Flexible Learning:
Online courses offer flexibility, allowing you to learn at your own pace and on your own schedule. This is particularly valuable for working professionals or individuals with busy lives.
Career Advancement:
Many Coursera courses offer certifications that can enhance your resume and demonstrate your skills to potential employers. Some even lead to full degrees.
Skill Development:
Coursera courses can help you acquire new skills or deepen your existing knowledge. This can be beneficial for career advancement, personal growth, or simply exploring new interests.
Specializations and Professional Certificates:
Coursera offers paths of learning that are a series of courses, that when completed, grant a specialization, or professional certificate. This can be very useful for those that are looking to prove they have a specific set of skills.
Factors to Consider:
Cost:
Some Coursera courses are free, while others require payment. Consider your budget and whether the cost aligns with the value you expect to receive.
Time Commitment:
Online courses require self-discipline and time management. Be prepared to dedicate sufficient time to complete the coursework.
Learning Style:
Online learning may not be suitable for everyone. Some individuals prefer the structure and interaction of traditional classroom settings.
Motivation:
Because online courses are self driven, it is very important to have self motivation.
The value of the certificate:
While many employers value Coursera certificates, their weight varies by industry and employer.
In","March 7, 2025 at 7:22:15 AM"
https://www.quora.com/Are-online-courses-by-Coursera-worth-it/log,"Coursera is a well-known platform offering courses from top universities at affordable prices. If you're looking to gain knowledge, explore new topics, or upskill at a low cost, Coursera can be a great option. Their courses cover a wide range of subjects, and some even come with certificates.
However, when it comes to job value, Coursera certificates may not hold much weight. Since many people complete the same courses, employers don’t always see them as a strong credential. Unlike certifications from top universities or industry leaders like AWS, Google, or Microsoft, Coursera’s certificates might not significantly boost your resume.
If your goal is to get a job or advance in your career, consider platforms that offer hands-on experience and industry-recognized certifications, such as AWS Training, Microsoft Learn, or Google Cloud Training.
In short, Coursera is good for learning but not the best for job-focused credentials. If you use it, focus on applying what you learn through real-world projects to make your knowledge valuable.","March 3, 2025 at 10:20:10 PM"
https://www.quora.com/Are-online-courses-by-Coursera-worth-it/log,"Coursera offers online courses that can be valuable for various reasons. These include quality content, partnerships with accredited institutions, flexibility and accessibility, career advancement, cost-effectiveness, networking, and peer learning. Coursera partners with top universities and organizations, providing access to high-quality, well-structured courses taught by industry experts. It also offers global accessibility, making it accessible to anyone with an internet connection. Coursera also offers practical, industry-relevant skills, professional certifications, and specialized programs. Coursera also offers financial aid for those unable to afford traditional education. However, Coursera certificates may not always be recognized as formal degrees in certain industries or countries. Additionally, online learning requires self-motivation and time management, which can be challenging without a structured environment. Overall, Coursera courses are a valuable investment for those seeking to develop new skills, advance their careers, or gain knowledge in specific areas.","February 25, 2025 at 3:29:07 PM"
https://www.quora.com/Are-online-courses-by-Coursera-worth-it/log,"Yes, online courses by Coursera are definitely worth it for many reasons. Here’s why:
1. High-Quality Content from Top Universities & Companies
Coursera partners with leading universities and organizations like Stanford, Yale, Google, IBM, and more. This means you get access to high-quality, expert-led courses that are based on the latest research and industry practices. The courses are designed by top professors and professionals, ensuring you're learning from the best.
2. Flexible Learning
One of the biggest advantages of Coursera is its flexibility. You can learn at your own pace, from anywhere, and at a time that fits your schedule. Whether you’re working full-time, managing other commitments, or just want to learn on the side, Coursera’s platform gives you the ability to learn when and where it’s most convenient for you.
3. Wide Range of Courses & Specializations
Coursera offers courses in virtually every field, from technology and data science to arts and humanities. Whether you want to learn programming, dive into machine learning, get certified in business management, or study healthcare management, Coursera has a course for you. You can even find specializations and professional certificates that give you a more in-depth education on specific topics.
4. Recognized Certificates
Coursera provides certificates upon completion, which are recognized by employers and industry leaders. Some courses, like the Google IT Support Professional Certificate, are specifically designed to help learners enter the workforce and have been developed in partnership with top companies looking for qualified employees. Earning a Coursera certificate can help boost your resume and demonstrate your commitment to learning new skills.
5. Affordable & Cost-Effective
Compared to traditional in-person education, Coursera offers courses at a fraction of the cost. Many courses are free to audit, and if you want a certificate, you can pay a reasonable fee. Additionally, Coursera offers financial aid for those who qualify, making high-quality education more accessible to everyone.
6. Practical Learning with Hands-On Projects
Many of Coursera’s courses are designed with practical learning in mind. You can work on real-world projects, interact with peers, and get feedback from instructors. This hands-on approach helps solidify your knowledge and ensures you’re ready to apply what you’ve learned in real job situations.
7. Learning for Career Advancement
Coursera’s courses are designed to help you gain skills that are in demand in the job market. Whether you’re looking to upskill in your current role or transition to a new career, Coursera provides you with the tools and knowledge to do so. Courses like the Data Science Specialization by Johns Hopkins University or the Google IT Support Professional Certificate are specifically created to help you build a career in emerging fields.
8. Continuous Learning & Networking
Coursera also offers a great platform for continuous learning. Once you complete a course, you can continue to take additional courses or enroll in a specialization. Plus, you’ll be part of a global community of learners, providing valuable networking opportunities and insights from peers and instructors.
If you’re considering whether Coursera is worth it, it depends on your goals. For those looking to upskill, advance their careers, or simply explore new fields of interest, Coursera is a fantastic option. The flexibility, affordability, and quality of education make it a strong choice for anyone looking to learn online.
If you’re ready to get started or explore more courses, feel free to check them out here.","February 2, 2025 at 5:14:29 PM"
https://www.quora.com/Are-online-courses-by-Coursera-worth-it/log,"Online courses by Coursera can indeed be worth it for several reasons:
Overall, Coursera's courses offer a great return on investment, especially if you are looking to enhance your skills and advance your career.
Are you considering a specific course or field of study?","January 21, 2025 at 5:58:07 PM"
https://www.quora.com/Are-online-courses-by-Coursera-worth-it/log,"Whether online courses by Coursera are worth it depends on your personal situation, goals, and ability to commit time. For students, who often have more time flexibility, Coursera can be an excellent resource. The platform offers high-quality courses from top universities and institutions, and students can take advantage of free or affordable options to build valuable skills in various fields, from business to technology.
For working professionals, especially those with busy schedules or 6-day workweeks, Coursera can still be worth it if you choose courses that allow you to learn at your own pace. However, the key challenge here is ensuring you have enough time to keep up with the material and apply the knowledge in a practical way. Live sessions or deadlines might be difficult to manage for those with limited free time.
In conclusion, if you’re a student or have flexible hours, Coursera can be a highly beneficial platform for learning and skill-building. For working professionals, it’s worth considering if you can realistically balance the course workload with your responsibilities.","January 21, 2025 at 5:27:09 PM"
https://www.quora.com/Are-online-courses-by-Coursera-worth-it/log,"#### Overview of Coursera Courses
**Coursera** is a popular online learning platform that offers a wide range of courses, specializations, and degrees from well-established universities and organizations. The value of these courses can vary based on individual goals, the specific course content, and the recognition of the certification.
#### Benefits of Coursera Courses
1. **Flexibility and Accessibility**: Coursera courses are designed to be flexible, allowing learners to study at their own pace. This makes it easier for individuals to fit learning into their busy schedules.
2. **Quality of Content**: Many courses are created in collaboration with reputable universities and industry leaders, ensuring that the content is relevant and up-to-date. This partnership often leads to a recognized certification that can enhance a resume.
3. **Career Advancement**: Completing a course or specialization can provide valuable skills that are attractive to employers. For instance, having a certificate in a relevant field can give candidates a competitive edge in job applications.
4. **Cost-Effectiveness**: Compared to traditional education, Coursera offers courses at a fraction of the cost, making it an accessible option for many learners.
#### Considerations
1. **Recognition of Certificates**: While many employers recognize Coursera certificates, the impact can vary by industry and specific job roles. Some employers may prioritize degrees over certificates.
2. **Self-Motivation Required**: Online learning requires a degree of self-discipline and motivation. Without these, learners may struggle to complete courses.
3. **Quality Variation**: Not all courses are created equal. It's essential to research and choose courses with good reviews and high completion rates.
#### Conclusion
In summary, **Coursera courses can be worth it** for individuals looking to gain new skills, enhance their resumes, or explore new fields of interest. The flexibility, quality of content, and potential for career advancement make it a valuable resource, especially when approached with clear goals and motivation. However, it's important to consider the recognition of the certification in your specific industry and to choose courses wisely.","January 11, 2025 at 4:29:46 PM"
https://www.quora.com/Are-online-courses-by-Coursera-worth-it/log,"Yes, Coursera courses are generally considered worth it, especially if you're looking to gain new skills, advance your career, or pursue personal development.","November 29, 2024 at 7:07:53 PM"
https://www.quora.com/Are-online-courses-by-Coursera-worth-it/log,"Top Online Tuition in Hyderabad: Elevate Your Learning with Gritty-Tech Academics
Looking for the best online classes in Hyderabad? Gritty-Tech Academics offers a premier online tuition experience tailored to CBSE, State Board, NEET, and IIT students. Here, our expert tutors provide flexible, personalized learning solutions that cater to each student’s unique needs, right from home.
Why Gritty-Tech Academics Stands Out for Online Tuition in Hyderabad
Gritty-Tech Academics has quickly become a trusted name in Hyderabad’s education landscape. Whether you're aiming to excel in board exams or preparing for competitive entrance exams, our expert-led programs create a supportive environment for every student. Here’s why:
CBSE Coaching in Hyderabad by Expert Tutors
Our specialized tutors ensure students receive quality CBSE coaching, laying strong academic foundations in every subject. Gritty-Tech’s tutors focus on conceptual understanding and skill-building, making learning comprehensive and effective.
One-on-One Online Classes for Personalized Learning
In Gritty-Tech’s one-on-one classes, each student benefits from a tailored learning experience. Personalized attention allows tutors to assess each student’s strengths and weaknesses, adjusting lessons to maximize progress. This focused approach is ideal for students who need a bit more support and guidance.
Comprehensive NEET and IIT Preparation
Aspirants aiming for medical or engineering schools require thorough preparation, and Gritty-Tech’s NEET and IIT programs are built to deliver. With a curriculum covering both basic and advanced topics, our programs help students master competitive exam techniques with confidence.
Progress Tracking in Online Tuition
With Gritty-Tech, progress tracking is an integral part of learning. Regular assessments and feedback sessions keep students on track, highlighting areas for improvement and celebrating growth. This structured tracking approach helps students and parents alike stay informed and motivated.
Interactive Group Classes in Hyderabad for Engaging Learning
Our interactive group classes foster collaboration and healthy competition, allowing students to discuss ideas and explore new concepts together. These classes are designed to create a well-rounded learning environment, where students can gain fresh insights and perspectives from peers.
Flexible Schedules, Affordable Pricing
Busy students need flexibility, and Gritty-Tech provides it. With options for evening and weekend classes, our programs fit seamlessly into any schedule, making education accessible and affordable for all.
Gritty-Tech Academics: Empowering Students to Succeed
Whether you’re seeking CBSE coaching, personalized learning, or expert tuition for competitive exams, Gritty-Tech Academics offers the tools and support students need to thrive. Join us today to start your journey toward academic success from the comfort of your home.
4o
AIPRM - ChatGPT Prompts","November 8, 2024 at 2:18:13 AM"
https://www.quora.com/Are-online-courses-by-Coursera-worth-it/log,"Credibility: Coursera's partnerships with universities and institutions add credibility to its courses.
Learning paths: Coursera offers a variety of learning paths, including free courses, professional certificates, and full degrees.
Content quality: Some say the content quality of Coursera courses is excellent.","November 2, 2024 at 12:57:33 PM"
https://www.quora.com/Are-online-courses-by-Coursera-worth-it/log,"Yes, Coursera courses can be worth it, especially for specific goals and skills. Here’s why:
1. **Access to High-Quality Content**: Coursera partners with top universities and companies, so courses often reflect current industry trends and standards.
2. **Flexible Learning Options**: Courses can be taken at your own pace, making them accessible for people with busy schedules.
3. **Certification and Credibility**: Certificates from well-known universities or companies (e.g., Google, Stanford) add credibility, especially for fields like data science, computer science, and business.
4. **Wide Range of Topics**: Coursera offers everything from beginner-level courses to specialized programs, making it easier to find a course that suits your READ MORE","October 27, 2024 at 8:40:42 PM"
