Question_Log_URL,Full_Answer_Text,Date
https://www.quora.com/Should-I-go-for-Coursera-or-Simplilearn-for-a-Data-Science-course/log,"Data science drives innovation and opportunity. Companies need data to make decisions, so data scientists are in demand. Coursera and Simplilearn are popular for entering or enhancing this dynamic field. This essay compares these two platforms with 1stepGrow, a data science training institute, to assist you in choosing.
Coursera is an online education platform that collaborates with universities all around the globe to provide courses, including data science.
Course: Data Science Professional Certificate.
Course features
Simplilearn
An important goal of Simplilearn is to provide its students with knowledge that they can use in the real world.
Course: Professional Certificate Course in Data Science
Features of Simplilearn
Getting Balanced
When choosing a data science course, weigh the pros and cons of each platform. Both Coursera and Simplilearn have limitations that may complicate your choice. Here's another platform with domain specialization, live interactive classes, and employment support.
1stepGrow
1stepGrow offers live data science classes. Develop your data science skills and apply them to real-world problems.
Course: Advanced Data Science and AI
You may attend all live and recorded sessions and have unlimited access to course materials once registered. Student subscriptions last three years.
The course features:
Have you considered why domain specialization matters?
Domain specialization ensures that data science abilities match business challenges. It increases your importance, problem-solving, and communication skills, making you a valuable asset for individualized decisions and career growth.
Your Route to Learning
The choice between Coursera and Simplilearn relies on aims and interests. Take into account your learning style, career ambitions, and education technique. I liked 1stepGrow's basic and professional courses; therefore, consider this while picking an institute.
Data science is always evolving; therefore, you must keep learning and growing regardless of platform.","January 8, 2024 at 8:30:45 PM"
https://www.quora.com/Should-I-go-for-Coursera-or-Simplilearn-for-a-Data-Science-course/log,"Coursera and Simplilearn are two reputed platforms that have a variety of courses available for students to learn data science, AI, ML, cybersecurity, and many more subjects. For a binary answer, you can check the conclusion, to make better-informed decisions. For a detailed review of the platforms, keep reading.
Some of the popular data science courses on Simplilearn are the CalTech Postgraduate program in Data Science, the Data Scientist program, and the Postgraduate program in Data Science.
The common features are,
📍Cons:
The online learning platform that provides IBM certificate data science courses for beginners and working professionals. Some of the popular data science programs are the IBM data science professional certification course and, the Bachelor of Science in Data Science and AI.
Some of the common features are,
📍 Cons:
Whether it is Simplilearn or Coursera, students do their research to enroll in any of the above programs. For a holistic learning experience, I would suggest you look for other institutes like 1stepGrow which offers a diverse understanding of the concepts through real-time domain-specific project works.
Just have a look over their key features, and get in touch with their expert team for further detailed information,
1stepGrow(Recommended):
One of the renowned growing institutes in Bangalore provides online data science, data analytics, and digital marketing courses for students and working professionals. Some of the featured programs are, the Advanced Data Science and AI course, Foundation in Data Science, and ML program.
Features are,
Aspirants can have Microsoft AI certification, and the project work done in collaboration with AI firms can give them the credit of Project experience certification from top AI companies like Truparnter.
With 280+ hiring partners of top MNCs and in collaboration with Microsoft they offer complete live class sessions, and industry-standard training for the students. The curriculum is curated by an experienced team of experts which meets the demands of real-time industry standards.
They also offer domain-specific training on 11 electives in manufacturing, oil and gas, supply chain operations, engineering, education, and more subjects. Based on their interests students can work on specific industry-level real-time live projects.
Some of the live project work done by top firms are,
The course fee costs less than a lakh rupees which brings lifetime access to the learning materials and an extended live class subscription for all the students.
As mentioned above, tie-ups with industries bring guaranteed job referrals to top companies for various job titles like data scientist, NLP engineer, ML engineer, Data analyst, BI developer, NLP specialist, and more. At the end of the course, students can have 100% job assistance with different phases of training on building the resume, soft skills training, etc.
The classes are completely live and the recorded live class sessions can be shared in case you miss any live sessions. Students can have 1:1 personalized counseling sessions and mentorship to clear their technical and non-technical doubts easily and quickly.
For binary seekers: 1stepGrow is recommended for freshers and working professionals who need a thorough understanding of data science concepts, with real-time practical exposure to domain specialization.","January 8, 2024 at 7:51:30 PM"
https://www.quora.com/Should-I-go-for-Coursera-or-Simplilearn-for-a-Data-Science-course/log,"When considering a Data Science course, making the right choice of where to pursue your education is crucial. Two prominent options in the field are Coursera and Simplilearn, each offering unique features and benefits. We’ll also discuss some other popular institutions like 1stepGrow, upgrad, etc, which provide data science courses.
However, In this comparison, we'll delve into the advantages and disadvantages of both platforms, enabling you to make an informed decision based on your learning preferences and goals.
Course: Data Science Specialization
🌀The course offers a flexible schedule, empowering students to manage their deadlines according to their individual needs and commitments.
🌀With an estimated completion time of around 11 months, dedicating about 7 hours per week, students can effectively plan their learning journey without rushing through the material.
🌀The course does not guarantee an increase in job opportunities or prospects, leaving students to navigate their career path after completion.
🌀Although a shareable certificate is provided, it might not hold enough weight to secure a job in a competitive job market.
🌀The course's case studies are not real-time, potentially missing out on the dynamic and evolving nature of industry scenarios.
🌀The self-paced nature of classes might lead to a lack of engagement and interaction, making the learning experience less stimulating.
🌀Students need a beginner-level understanding of Python programming and familiarity with Regression for optimal learning; this could exclude some individuals from fully benefiting.
Course: Data Scientist
🍁The course covers various data science topics, introducing students to a wide array of concepts that are essential in the field.
🍁One of the drawbacks of the course is its absence of industry-specific specialized learning modules. This shortfall could be a concern for working professionals who require targeted skills for their specific roles.
🍁The course's large batch size could lead to reduced effectiveness. In a large group, personalized doubt clarification and individual attention might be challenging, potentially impacting the learning experience.
🍁Besides the course fees, learners might encounter additional costs for learning resources, which could add up and make the course less cost-effective than initially perceived.
THE ALTERNATIVES TO CONSIDER:
The online market is expansive, and beyond platforms like Coursera and Simplilearn, there are numerous other options such as 1stepGrow, UpGrad, and more that offer top-quality data science courses. Let's explore these alternatives as well.
Course: Advance Data Science and AI course
🏅The course offers domain specialization, allowing students to specialize in areas relevant to their career aspirations. This specialization ensures that graduates are well-equipped with skills directly applicable to their chosen industry.
🏅One of the key advantages of the course is its live interactive classes. These classes foster real-time engagement between instructors and students, providing opportunities for immediate doubt clarification, personalized guidance, and dynamic discussions.
🏅The course costs a very affordable rate for around 11 to 13 months. In comparison, this is a very low fee for a high-level course with 24+ real-time projects, 4+ industry-based projects, and an extensive range of 20+ tools.
🏅These hands-on industry projects build practical skills and create a portfolio showcasing their capabilities to potential employers.
🏅The course is taught by experienced data science professionals from top MNCs who bring real-world insights into the classroom.
🏅Their expertise ensures that students receive relevant, up-to-date knowledge and learn from those who have successfully navigated the field.
🏅100% career support is available including resume building, interview preparation, and networking opportunities. This support aims to bridge the gap between completing the course and entering the job market.
Course: Master of Science in Data Science
🎈In this course, they train their students with MS Excel, Python, Tableau, and SQL.
🎈The students who are just going to start from scratch may find it a bit difficult with the modules that consist of pre-recorded videos, so there is no possibility of live doubt clarification in such modules.
🎈The course fee is rather high, and even if you pay it, there is a lack of job assurance. For those who do not match the criteria for the guaranteed job opportunity, there is no provision for a refund of fees paid or any other type of compensation for the missed opportunity.
🎈Case studies and capstone projects are not available in real-time. So, you will not be solving the project's difficulties in a real-world industry context.
In the decision between Coursera and Simplilearn for a Data Science course, it's crucial to consider the key elements that align with your learning objectives. While both platforms have their merits, it's advisable to seek a course that encompasses the comprehensive features found in certain alternatives.
When evaluating your options, prioritize a program that offers domain specialization, live interactive sessions, hands-on case studies, experienced instructors, robust career support, and industry-relevant projects. By selecting a course with these qualities, you can ensure a well-rounded and effective learning experience that equips you with practical skills and prepares you for real-world challenges.","January 5, 2024 at 5:20:16 PM"
https://www.quora.com/Should-I-go-for-Coursera-or-Simplilearn-for-a-Data-Science-course/log,"Data science is undoubtedly in huge demand in today's rapidly evolving job market. With the increasing popularity of data-driven decision-making, many individuals, especially freshers, are keen on pursuing a Data Science course to enhance their skills and career prospects.
Among the myriad of options available, Simplilearn and Coursera stand out as popular choices, each with its unique advantages.
Let's delve into a detailed comparison to help you make an informed decision:
Simplilearn:
Simplilearn is renowned for its comprehensive approach to online learning. They offer a structured Data Science course that covers a wide range of topics, providing a solid foundation in statistical concepts, machine learning algorithms, and data visualization. The emphasis on hands-on projects and industry-relevant case studies is a notable feature, allowing learners to apply theoretical knowledge in practical scenarios.
Pros:
Cons:
Coursera:
Coursera, on the other hand, is a widely recognized online learning platform that collaborates with top universities and industry experts to deliver courses. The Data Science courses on Coursera, including the popular ""Data Science Specialization"" by Johns Hopkins University, offer a more academic approach, combining video lectures with assignments and quizzes.
Pros:
Cons:
The Decision:
Choosing between Simplilearn and Coursera depends on your learning style, budget, and career goals. If you are a fresher looking for a hands-on approach with practical projects, Simplilearn might be the better choice. On the other hand, if you prefer a more academic and structured learning experience with certificates from top universities, Coursera could be the ideal platform.
But for professionals currently working and aiming to switch to data science, the above platforms may not the best choice, for them I would like to recommend Tutort Academy. They focuses on domain-specialization, providing real-time end-to-end projects that are crucial for transitioning smoothly into a data science role in your specific industry. Here are salient key features of their programs -
In conclusion, both Simplilearn and Coursera have their merits, and your choice should align with your learning preferences and career objectives. Always research thoroughly, read reviews, and consider trial options if available before making a decision.","January 3, 2024 at 11:10:54 AM"
https://www.quora.com/What-is-Coursera-Is-it-useful/log,"Tired of theory-only courses? At Career Craft, we combine hands-on learning, live industry projects, and placements — with pricing that’s easy on your wallet!","April 4, 2025 at 7:50:08 PM"
https://www.quora.com/What-is-Coursera-Is-it-useful/log,"Coursera is a leading online learning platform that partners with top universities and organizations worldwide to offer a wide range of courses, specializations, and degree programs. Whether you're looking to learn new skills, advance your career, or simply explore a new subject, Coursera can be incredibly useful.
Here’s why:
For a more in-depth look at what Coursera offers, including costs, free course options, and the value of its certificates, check out the article ""Is Coursera Worth It? Costs, Free Courses, and Certificates Explained"". It provides all the details you need to decide if Coursera is right for you.","August 14, 2024 at 6:06:55 PM"
https://www.quora.com/What-is-Coursera-Is-it-useful/log,"Coursera | Degrees, Certificates, & Free Online Courses stands as a premier online learning platform offering a plethora of courses, specializations, and degree programs crafted by esteemed universities and organizations globally. Established in 2012, Coursera collaborates with over 200 prestigious institutions, democratizing access to top-tier education worldwide. Its extensive catalog spans diverse domains such as technology, business, data science, health, and humanities. Learners benefit from video lectures, quizzes, assignments, and interactive forums, often available either for free or for a nominal fee. With the option to earn certificates and degrees upon completion, Coursera, partnered with institutions like OnlineUniversitiess, empowers learners to advance their skills and pursue higher education conveniently from anywhere.","April 19, 2024 at 8:33:35 PM"
https://www.quora.com/What-is-your-review-of-Coursera-Machine-Learning/log,"It’s a classic—but more of a documentary than a bootcamp.
Andrew Ng’s course is foundational. If you’re new to ML, it’s a great place to understand concepts like linear regression, logistic regression, neural networks, etc.
PROS:
Best conceptual clarity
Clear explanations
Free to audit
CONS:
No Python (you’ll use Octave)
No real-world projects
No mentor support
No interview prep
After doing it, most people still feel unprepared to face recruiters.
That’s where Tutort Academy helped me:
Taught Python-based ML
Walked me through building and deploying models
Prepped me with mock interviews + GitHub reviews
Helped me land a job in 4 months
Final Word: Coursera = Theoretical backbone.
Tutort = End-to-end, career-focused ML coaching.","April 23, 2025 at 8:14:42 PM"
https://www.quora.com/What-is-your-review-of-Coursera-Machine-Learning/log,"Ah yes, Coursera’s Machine Learning course by Andrew Ng—the one that practically every aspiring data scientist has bookmarked, started, or at least heard about.
If you’re wondering whether it lives up to the hype, whether it’s too old to be relevant, or if it’s the right move for your learning path, let me give you the full picture—the kind I’d give a mentee who’s sitting across the table from me, sipping coffee, saying: “I want to get into ML, and this course keeps coming up. Should I take it?”
Let’s Start With the Basics
This course is taught by Andrew Ng, Stanford professor, co-founder of Coursera, and an all-around rockstar in the ML world. It’s been around since 2012, and at one point, it was the most popular online course in the world.
So… is it still good in 2025?
Yes—but with caveats.
What Makes It Worthwhile (Even Now)
1. Crystal-Clear Teaching
Andrew Ng has a real gift for explaining complex topics in a way that makes sense. He doesn’t just throw equations at you—he walks you through the intuition behind algorithms like linear regression, logistic regression, SVMs, neural networks, and more.
It’s one of the few courses where people regularly say, “Ohhh… now I get it.”
2. Strong Math Foundation
If you’re serious about machine learning—not just dragging sliders in a GUI or copying code from GitHub—this course gives you the math chops you’ll need. It’s not overwhelming, but it doesn’t dumb things down either. You’ll learn the guts of algorithms, like:
This stuff matters when things break in production or when you’re debugging why your model’s accuracy is garbage.
3. Well-Structured Curriculum
Everything builds logically. No jumping from topic to topic. It’s like being led up a staircase—each lesson is a small, digestible step.
4. It’s a Confidence Builder
Many folks (myself included) finished this course and felt like they’d finally “unlocked” the ML world. It's not job-training on its own, but it's a mental shift—you stop being intimidated by ML terms and start thinking like a practitioner.
Where It Shows Its Age
1. It’s in MATLAB/Octave
Yeah, you read that right. Not Python. Not R. Octave. Why? Simplicity, mostly—Octave makes it easier to focus on algorithms without worrying about syntax.
But let’s be real: no one’s deploying ML models in Octave in 2025.
That means once you finish the course, you’ll need to relearn the implementation part in Python (NumPy, scikit-learn, TensorFlow, etc.). The concepts transfer 100%, but the syntax won’t.
If that’s a dealbreaker for you, Andrew Ng’s “Machine Learning Specialization” (newer version in Python) might be a better fit. It’s basically an updated take on this classic course, still taught by him, but using modern tools.
2. No Deep Learning
Back when the course came out, deep learning wasn’t mainstream. So this course focuses mostly on traditional ML algorithms—decision trees, regression, SVMs, k-means, etc.
Still valuable, but if you're trying to build image classifiers or LLMs, you’ll need to go further.
(And guess what? Andrew Ng has a whole Deep Learning Specialization for that too.)
3. Not Project-Based
This course teaches you how ML works, but not necessarily how to apply it to real-world problems. You’ll do exercises in Octave, but you won’t build end-to-end projects like predicting housing prices from scratch in Jupyter.
So while you’ll understand the theory, you might still be unsure how to turn that into a portfolio project. You’ll need to supplement with hands-on practice elsewhere—think Kaggle, personal datasets, or side projects.
Who This Course Is Perfect For
Who Might Want to Skip It (or Come Back Later)
What I Tell My Mentees
I usually say: Take it—but take it with the right mindset.
Don’t treat it like your only course. Treat it like your foundation. You’re learning how engines work before trying to drive a car at high speed.
Then follow it up with:
Final Thought
Taking this course won’t make you a data scientist overnight—but it will give you a deep, rock-solid understanding of the core algorithms that still power most of what we use today.
It’s not hype. It’s not fluff. It’s old, but like a classic book, it still holds up—if you're ready to think deeply, not just code quickly.
So yeah—I still recommend it.
Just don’t stop there. That’s where most people fall short.
And hey, if you do end up taking it, reach out if you get stuck on gradient descent. I’ve been there. Multiple times. You’re not alone.","April 18, 2025 at 6:05:32 PM"
https://www.quora.com/What-is-your-review-of-Coursera-Machine-Learning/log,"🌟 Machine Learning & Coursera: A Modern-Day Career Catalyst
Machine Learning (ML) isn’t just a buzzword—it’s a career-defining shift. As industries embrace AI-driven solutions and data becomes the new oil, machine learning is leading the charge. And thanks to platforms like Coursera, world-class ML education is no longer locked behind elite institutions—it’s available to anyone, anywhere.
Let’s break it all down 👇
🔍 Coursera’s Machine Learning Course: A Deep Dive
Why it Stands Out:
Where It Falls Short:
🎯 Is Machine Learning a Smart Career Move?
Absolutely—ML continues to top charts for growth and innovation. Here’s why:
But keep in mind:
🔥 Why Machine Learning is Trending (and Staying Relevant)
Simply put—ML turns raw data into smart actions.
💻 Online Learning: Can It Really Work for ML?
Yes—if you're intentional.
🌞 Final Thoughts: Why ML + Coursera = Opportunity
Machine learning is reshaping the world—and platforms like Coursera are putting the tools to master it right at your fingertips. While it takes dedication and continuous learning, the payoff in skills, opportunity, and impact is huge.
If you’re looking to turn curiosity into capability, ML is a field that rewards explorers.
And hey—if you want to level up even further, platforms like Tutort Academy (which offers project-based learning, live mentorship, and real-time Python tools) can complement Coursera perfectly.
🚀 The future belongs to those who teach machines to learn. Are you ready to be one of them?","April 18, 2025 at 1:07:17 AM"
https://www.quora.com/What-is-your-review-of-Coursera-Machine-Learning/log,"JUDGE: Let's hear the case of ""Coursera’s Machine Learning Course by Andrew Ng vs. Real Job-Readiness.""
DEFENSE (COURSERA):
""We offer a legendary intro to ML. Andrew Ng teaches concepts like linear regression, neural nets, and SVMs—brilliantly!""
PROSECUTION (JOB SEEKER):
""Yes, but it’s mostly theoretical. No live projects. No Python (it's in Octave). No career coaching. I couldn’t build a real portfolio.""
WITNESS (TUTORT ACADEMY STUDENT):
""After Coursera, I still couldn’t crack job interviews. Joined Tutort Academy—got 1:1 mentorship, real projects, resume feedback, mock interviews. Boom! Landed my dream ML role in 4 months.""
VERDICT:
Coursera’s course is a must-watch—like a documentary.
Tutort is where you get trained like an athlete for the big leagues.","April 17, 2025 at 8:42:02 PM"
https://www.quora.com/What-is-your-review-of-Coursera-Machine-Learning/log,"I still remember the moment I decided to learn Machine Learning.
I was sitting at my desk, scrolling past buzzwords like neural networks, data-driven models, AI revolution—all of them sounded cool, yet overwhelmingly complex. My background wasn’t in computer science. I had no PhD. No fancy tech job. Just a burning curiosity.
So I did what anyone would do—I started looking for a course that could make Machine Learning feel less like rocket science and more like an exciting adventure. 🌌
And oh boy... I found the one.
💡 What Made It So Special?
This course didn’t just throw math at me. It walked me through real-world problems with practical explanations, intuitive visuals, and step-by-step breakdowns that made complex topics feel... human.
Here’s why it stood out:
But here’s the thing—great content is just the start.
🌐 Where the Real Magic Happens...
🔍 Final Thoughts
If you’re just starting out in Machine Learning, let me tell you this:
You don’t need to know everything. You don’t need to be a genius. You just need curiosity, consistency, and the right direction.
Start with one course. Master the basics. Build something small. Break it. Fix it. Then grow.
Because in this field, you’re not just learning how machines think—you’re learning how to think better yourself. 🧠💥
And trust me, that’s the most powerful upgrade you’ll ever unlock.","April 17, 2025 at 7:48:01 PM"
https://www.quora.com/What-is-your-review-of-Coursera-Machine-Learning/log,"Ohh man, Coursera’s Machine Learning course by Andrew Ng? That's like the OG course — kind of a rite of passage for anyone getting into ML. Here's the real talk, Reddit-style:
🧠 What’s Good?
⚠️ But Be Aware:
✅ Bottom Line?","April 17, 2025 at 10:29:33 AM"
https://www.quora.com/What-is-your-review-of-Coursera-Machine-Learning/log,"Tired of theory-only courses? At Career Craft, we combine hands-on learning, live industry projects, and placements — with pricing that’s easy on your wallet!","April 4, 2025 at 7:50:21 PM"
